{
  "id": "workbuddy/smartsalary",
  "slug": "smartsalary",
  "harness": "workbuddy",
  "name": "eRoad·市场人才薪酬数据",
  "description": "连接薪智（SmartSalary），把外部人才与薪酬市场数据带入现有工作流",
  "kind": "远程 MCP",
  "source_repository": null,
  "source_status": "reported-not-independently-verified",
  "provenance": {
    "source": "workbuddy-connector-inventory",
    "snapshot_date": "2026-10-14",
    "definition": "marketplace-mcp-json",
    "inventory_sha256": "ddcb3fdee6690a2df9488621ff475f800575741ba8bb9acecfb86792ecea7c08"
  },
  "connection": {
    "transport": "streamable-http",
    "url": "https://ai.smartsalary.cn/smartsalary-mcp/mcp",
    "headers": {}
  },
  "parameters": [],
  "auth": {
    "mode": "unknown",
    "instructions": "需查阅服务商文档，独立申请凭据或完成 OAuth；未验证跨客户端授权。"
  },
  "availability": "candidate",
  "reason": "来源配置已归一化；须独立验证协议、认证和客户端兼容性。",
  "verification": {
    "structure": "pending",
    "protocol": "not-tested",
    "business": "not-tested"
  }
}
