{
  "id": "workbuddy/eccang-reconcile",
  "slug": "eccang-reconcile",
  "harness": "workbuddy",
  "name": "易仓跨境对账",
  "description": "发一份平台结算 Excel，自动核对 TikTok Shop / Tokopedia 账单与易仓结算数据：比对订单数与结算金额，标出金额差异、单",
  "kind": "远程 MCP",
  "source_repository": null,
  "source_status": "reported-not-independently-verified",
  "provenance": {
    "source": "workbuddy-connector-inventory",
    "snapshot_date": "2026-10-14",
    "definition": "marketplace-mcp-json",
    "inventory_sha256": "ddcb3fdee6690a2df9488621ff475f800575741ba8bb9acecfb86792ecea7c08"
  },
  "connection": {
    "transport": "streamable-http",
    "url": "https://datacenter.eccang.com/nexus/mcp/stream",
    "headers": {}
  },
  "parameters": [],
  "auth": {
    "mode": "unknown",
    "instructions": "需查阅服务商文档，独立申请凭据或完成 OAuth；未验证跨客户端授权。"
  },
  "availability": "candidate",
  "reason": "来源配置已归一化；须独立验证协议、认证和客户端兼容性。",
  "verification": {
    "structure": "pending",
    "protocol": "not-tested",
    "business": "not-tested"
  }
}
