{
  "id": "workbuddy/feishu",
  "slug": "feishu",
  "harness": "workbuddy",
  "name": "飞书",
  "description": "通过命令行管理飞书/Lark 全产品能力：即时通讯、邮箱、日历、云文档、电子表格、多维表格（Base）、幻灯片、画板、知识库、云空间、妙记、视频",
  "kind": "本地 CLI (npm)",
  "source_repository": "https://github.com/larksuite/cli",
  "source_status": "reported-not-independently-verified",
  "provenance": {
    "source": "workbuddy-connector-inventory",
    "snapshot_date": "2026-10-14",
    "definition": "inventory-only",
    "inventory_sha256": "ddcb3fdee6690a2df9488621ff475f800575741ba8bb9acecfb86792ecea7c08"
  },
  "connection": null,
  "parameters": [],
  "auth": {
    "mode": "unknown",
    "instructions": "需查阅服务商文档，独立申请凭据或完成 OAuth；未验证跨客户端授权。"
  },
  "availability": "not-mcp",
  "reason": "原清单标为 CLI 或 Skill；未证实其提供 MCP 协议。",
  "verification": {
    "structure": "passed",
    "protocol": "not-tested",
    "business": "not-tested"
  }
}
