{
  "id": "workbuddy/tencent-tchouse-c",
  "slug": "tencent-tchouse-c",
  "harness": "workbuddy",
  "name": "腾讯云数据仓库 TCHouse-C",
  "description": "腾讯云数据仓库 TCHouse-C 智能运维与分析助手，用自然语言完成集群健康诊断、慢 SQL 分析、规格选型推荐、表结构设计与 NL2SQL",
  "kind": "远程 MCP",
  "source_repository": null,
  "source_status": "reported-not-independently-verified",
  "provenance": {
    "source": "workbuddy-connector-inventory",
    "snapshot_date": "2026-10-14",
    "definition": "marketplace-mcp-json",
    "inventory_sha256": "ddcb3fdee6690a2df9488621ff475f800575741ba8bb9acecfb86792ecea7c08"
  },
  "connection": {
    "transport": "streamable-http",
    "url": "https://tcmcpserver.cloud.tencent.com/tchousec/mcp",
    "headers": {}
  },
  "parameters": [],
  "auth": {
    "mode": "unknown",
    "instructions": "需查阅服务商文档，独立申请凭据或完成 OAuth；未验证跨客户端授权。"
  },
  "availability": "candidate",
  "reason": "来源配置已归一化；须独立验证协议、认证和客户端兼容性。",
  "verification": {
    "structure": "pending",
    "protocol": "not-tested",
    "business": "not-tested"
  }
}
