{
  "id": "workbuddy/haier-assistant",
  "slug": "haier-assistant",
  "harness": "workbuddy",
  "name": "海尔智能体",
  "description": "海尔、卡萨帝、统帅家电的选购推荐、型号对比、参数与价格咨询、购买渠道与门店查询，以及售后服务知识解答",
  "kind": "远程 MCP",
  "source_repository": null,
  "source_status": "reported-not-independently-verified",
  "provenance": {
    "source": "workbuddy-connector-inventory",
    "snapshot_date": "2026-10-14",
    "definition": "marketplace-mcp-json",
    "inventory_sha256": "ddcb3fdee6690a2df9488621ff475f800575741ba8bb9acecfb86792ecea7c08"
  },
  "connection": {
    "transport": "streamable-http",
    "url": "https://web-hdsuec-agent.haier.net/mcp",
    "headers": {}
  },
  "parameters": [],
  "auth": {
    "mode": "server-side",
    "instructions": "需查阅服务商文档，独立申请凭据或完成 OAuth；未验证跨客户端授权。"
  },
  "availability": "candidate",
  "reason": "来源配置已归一化；须独立验证协议、认证和客户端兼容性。",
  "verification": {
    "structure": "pending",
    "protocol": "not-tested",
    "business": "not-tested"
  }
}
