{
  "id": "workbuddy/sq-company-dynamic",
  "slug": "sq-company-dynamic",
  "harness": "workbuddy",
  "name": "上奇产业通",
  "description": "上奇产业通MCP提供「产业—区域—企业」三维产业数据服务，支持产业链图谱与长短板诊断、区域产业全景与近三年迁移监测、企业工商/经营/融资/供应链",
  "kind": "远程 MCP",
  "source_repository": null,
  "source_status": "reported-not-independently-verified",
  "provenance": {
    "source": "workbuddy-connector-inventory",
    "snapshot_date": "2026-10-14",
    "definition": "marketplace-mcp-json",
    "inventory_sha256": "ddcb3fdee6690a2df9488621ff475f800575741ba8bb9acecfb86792ecea7c08"
  },
  "connection": {
    "transport": "streamable-http",
    "url": "https://api.chanyedata.com/mcp/c3f5924cc60dbe1729f5cc332e627304/mcp",
    "headers": {
      "Authorization": "${WB_SQ_COMPANY_DYNAMIC_HEADER_AUTHORIZATION}"
    }
  },
  "parameters": [
    {
      "name": "WB_SQ_COMPANY_DYNAMIC_HEADER_AUTHORIZATION",
      "location": "header",
      "key": "Authorization",
      "required": true,
      "description": "填写完整 Authorization 头值，包含 Bearer 前缀（若服务商要求）。"
    }
  ],
  "auth": {
    "mode": "parameters-required",
    "instructions": "需查阅服务商文档，独立申请凭据或完成 OAuth；未验证跨客户端授权。"
  },
  "availability": "candidate",
  "reason": "来源配置已归一化；须独立验证协议、认证和客户端兼容性。",
  "verification": {
    "structure": "pending",
    "protocol": "not-tested",
    "business": "not-tested"
  }
}
