{
  "id": "workbuddy/fanruan-growth-advisor",
  "slug": "fanruan-growth-advisor",
  "harness": "workbuddy",
  "name": "帆软增长谋士",
  "description": "企业洞察与增长分析：查询企业经营风险、舆情、招投标、专利、资质、政策等公开商业数据，并调用已授权的 MOSS 增长谋士 Agent 生成分析与报",
  "kind": "远程 MCP",
  "source_repository": null,
  "source_status": "reported-not-independently-verified",
  "provenance": {
    "source": "workbuddy-connector-inventory",
    "snapshot_date": "2026-10-14",
    "definition": "marketplace-mcp-json",
    "inventory_sha256": "ddcb3fdee6690a2df9488621ff475f800575741ba8bb9acecfb86792ecea7c08"
  },
  "connection": {
    "transport": "streamable-http",
    "url": "https://www.mossdo.com/api/v1/mcp",
    "headers": {
      "X-Moss-WorkBuddy": "${WB_FANRUAN_GROWTH_ADVISOR_HEADER_X_MOSS_WORKBUDDY}"
    }
  },
  "parameters": [
    {
      "name": "WB_FANRUAN_GROWTH_ADVISOR_HEADER_X_MOSS_WORKBUDDY",
      "location": "header",
      "key": "X-Moss-WorkBuddy",
      "required": true,
      "description": "从服务商独立获取并填写；不复用 WorkBuddy 私有凭据。"
    }
  ],
  "auth": {
    "mode": "parameters-required",
    "instructions": "需查阅服务商文档，独立申请凭据或完成 OAuth；未验证跨客户端授权。"
  },
  "availability": "candidate",
  "reason": "来源配置已归一化；须独立验证协议、认证和客户端兼容性。",
  "verification": {
    "structure": "pending",
    "protocol": "not-tested",
    "business": "not-tested"
  }
}
