{
  "id": "workbuddy/ezr-crm",
  "slug": "ezr-crm",
  "harness": "workbuddy",
  "name": "EZR 全域CRM",
  "description": "连接 EZR 全域 CRM，把会员、销售、活动、企微运营、券分析、商城运营、人群圈选和 MA 画布监控等能力带入智能体，帮助品牌用自然语言完成经",
  "kind": "远程 MCP",
  "source_repository": null,
  "source_status": "reported-not-independently-verified",
  "provenance": {
    "source": "workbuddy-connector-inventory",
    "snapshot_date": "2026-10-14",
    "definition": "marketplace-mcp-json",
    "inventory_sha256": "ddcb3fdee6690a2df9488621ff475f800575741ba8bb9acecfb86792ecea7c08"
  },
  "connection": {
    "transport": "streamable-http",
    "url": "https://skillsgateway-tp.ezrpro.com/ezr/mcp",
    "headers": {}
  },
  "parameters": [],
  "auth": {
    "mode": "server-side",
    "instructions": "需查阅服务商文档，独立申请凭据或完成 OAuth；未验证跨客户端授权。"
  },
  "availability": "candidate",
  "reason": "来源配置已归一化；须独立验证协议、认证和客户端兼容性。",
  "verification": {
    "structure": "pending",
    "protocol": "not-tested",
    "business": "not-tested"
  }
}
