{
  "id": "workbuddy/jiushuyun",
  "slug": "jiushuyun",
  "harness": "workbuddy",
  "name": "九数云BI",
  "description": "上传 Excel 或 CSV 表格，一键生成原生的可视化数据分析报告、仪表板、图表",
  "kind": "远程 MCP",
  "source_repository": null,
  "source_status": "reported-not-independently-verified",
  "provenance": {
    "source": "workbuddy-connector-inventory",
    "snapshot_date": "2026-10-14",
    "definition": "marketplace-mcp-json",
    "inventory_sha256": "ddcb3fdee6690a2df9488621ff475f800575741ba8bb9acecfb86792ecea7c08"
  },
  "connection": {
    "transport": "streamable-http",
    "url": "https://work.jiushuyun.com/mcp",
    "headers": {}
  },
  "parameters": [],
  "auth": {
    "mode": "unknown",
    "instructions": "需查阅服务商文档，独立申请凭据或完成 OAuth；未验证跨客户端授权。"
  },
  "availability": "candidate",
  "reason": "来源配置已归一化；须独立验证协议、认证和客户端兼容性。",
  "verification": {
    "structure": "passed",
    "protocol": "not-tested",
    "business": "not-tested"
  }
}
