{
  "id": "workbuddy/wscnmcp-token",
  "slug": "wscnmcp-token",
  "harness": "workbuddy",
  "name": "华尔街见闻",
  "description": "华尔街见闻MCP —— 提供 A 股大涨股异动归因与华尔街见闻全球财经资讯查询能力",
  "kind": "远程 MCP",
  "source_repository": null,
  "source_status": "reported-not-independently-verified",
  "provenance": {
    "source": "workbuddy-connector-inventory",
    "snapshot_date": "2026-10-14",
    "definition": "marketplace-mcp-json",
    "inventory_sha256": "ddcb3fdee6690a2df9488621ff475f800575741ba8bb9acecfb86792ecea7c08"
  },
  "connection": {
    "transport": "streamable-http",
    "url": "https://xgb-mcp-api.xuangubao.cn/mcp",
    "headers": {
      "Authorization": "${WB_WSCNMCP_TOKEN_HEADER_AUTHORIZATION}",
      "X-WMCP-Client": "${WB_WSCNMCP_TOKEN_HEADER_X_WMCP_CLIENT}"
    }
  },
  "parameters": [
    {
      "name": "WB_WSCNMCP_TOKEN_HEADER_AUTHORIZATION",
      "location": "header",
      "key": "Authorization",
      "required": true,
      "description": "填写完整 Authorization 头值，包含 Bearer 前缀（若服务商要求）。"
    },
    {
      "name": "WB_WSCNMCP_TOKEN_HEADER_X_WMCP_CLIENT",
      "location": "header",
      "key": "X-WMCP-Client",
      "required": true,
      "description": "从服务商独立获取并填写；不复用 WorkBuddy 私有凭据。"
    }
  ],
  "auth": {
    "mode": "parameters-required",
    "instructions": "需查阅服务商文档，独立申请凭据或完成 OAuth；未验证跨客户端授权。"
  },
  "availability": "candidate",
  "reason": "来源配置已归一化；须独立验证协议、认证和客户端兼容性。",
  "verification": {
    "structure": "pending",
    "protocol": "not-tested",
    "business": "not-tested"
  }
}
