{
  "id": "workbuddy/xrxs",
  "slug": "xrxs",
  "harness": "workbuddy",
  "name": "薪人薪事",
  "description": "通过自然语言管理薪人薪事员工入职、离职及考勤月度报表归档等 HR 场景",
  "kind": "远程 MCP",
  "source_repository": null,
  "source_status": "reported-not-independently-verified",
  "provenance": {
    "source": "workbuddy-connector-inventory",
    "snapshot_date": "2026-10-14",
    "definition": "marketplace-mcp-json",
    "inventory_sha256": "ddcb3fdee6690a2df9488621ff475f800575741ba8bb9acecfb86792ecea7c08"
  },
  "connection": {
    "transport": "streamable-http",
    "url": "https://mcp-xrxs.xinrenxinshi.com/mcp",
    "headers": {}
  },
  "parameters": [],
  "auth": {
    "mode": "server-side",
    "instructions": "需查阅服务商文档，独立申请凭据或完成 OAuth；未验证跨客户端授权。"
  },
  "availability": "candidate",
  "reason": "来源配置已归一化；须独立验证协议、认证和客户端兼容性。",
  "verification": {
    "structure": "passed",
    "protocol": "not-tested",
    "business": "not-tested"
  }
}
