{
  "id": "workbuddy/westock-mcp",
  "slug": "westock-mcp",
  "harness": "workbuddy",
  "name": "腾讯自选股",
  "description": "直连腾讯自选股，实时掌握毫秒级行情与资金动态，用自然语言分析自选数据、设置股价提醒、管理模拟交易，轻松搞定盯盘与投资决策",
  "kind": "远程 MCP",
  "source_repository": null,
  "source_status": "reported-not-independently-verified",
  "provenance": {
    "source": "workbuddy-connector-inventory",
    "snapshot_date": "2026-10-14",
    "definition": "marketplace-mcp-json",
    "inventory_sha256": "ddcb3fdee6690a2df9488621ff475f800575741ba8bb9acecfb86792ecea7c08"
  },
  "connection": {
    "transport": "streamable-http",
    "url": "https://stockbuddy.qq.com/cgi/cgi-bin/openai/mcp/mcp",
    "headers": {}
  },
  "parameters": [],
  "auth": {
    "mode": "unknown",
    "instructions": "需查阅服务商文档，独立申请凭据或完成 OAuth；未验证跨客户端授权。"
  },
  "availability": "candidate",
  "reason": "来源配置已归一化；须独立验证协议、认证和客户端兼容性。",
  "verification": {
    "structure": "passed",
    "protocol": "not-tested",
    "business": "not-tested"
  }
}
