{
  "id": "workbuddy/sharecrm",
  "slug": "sharecrm",
  "harness": "workbuddy",
  "name": "纷享销客CRM",
  "description": "用自然语言查询客户、推进商机、写跟进记录、处理审批、建图表等，轻松搞定销售全链路工作",
  "kind": "远程 MCP",
  "source_repository": null,
  "source_status": "reported-not-independently-verified",
  "provenance": {
    "source": "workbuddy-connector-inventory",
    "snapshot_date": "2026-10-14",
    "definition": "marketplace-mcp-json",
    "inventory_sha256": "ddcb3fdee6690a2df9488621ff475f800575741ba8bb9acecfb86792ecea7c08"
  },
  "connection": {
    "transport": "streamable-http",
    "url": "https://open.fxiaoke.com/mcp/connector?id=${WB_SHARECRM_QUERY_ID}",
    "headers": {}
  },
  "parameters": [
    {
      "name": "WB_SHARECRM_QUERY_ID",
      "location": "query",
      "key": "id",
      "required": true,
      "description": "从服务商独立获取并填写；不复用 WorkBuddy 私有凭据。"
    }
  ],
  "auth": {
    "mode": "parameters-required",
    "instructions": "需查阅服务商文档，独立申请凭据或完成 OAuth；未验证跨客户端授权。"
  },
  "availability": "candidate",
  "reason": "来源配置已归一化；须独立验证协议、认证和客户端兼容性。",
  "verification": {
    "structure": "pending",
    "protocol": "not-tested",
    "business": "not-tested"
  }
}
