{
  "id": "workbuddy/gaodun-job",
  "slug": "gaodun-job",
  "harness": "workbuddy",
  "name": "高顿•实习就业助手",
  "description": "大学生实习就业全链路 AI 助手：智能推荐公考岗位，检索实习与校招职位，提供 MBTI、霍兰德等职业测评，简历诊断与 AI 优化改写，面试刷题与",
  "kind": "远程 MCP",
  "source_repository": null,
  "source_status": "reported-not-independently-verified",
  "provenance": {
    "source": "workbuddy-connector-inventory",
    "snapshot_date": "2026-10-14",
    "definition": "marketplace-mcp-json",
    "inventory_sha256": "ddcb3fdee6690a2df9488621ff475f800575741ba8bb9acecfb86792ecea7c08"
  },
  "connection": {
    "transport": "streamable-http",
    "url": "https://apigateway.gaodun.com/dyson/mcp",
    "headers": {}
  },
  "parameters": [],
  "auth": {
    "mode": "unknown",
    "instructions": "需查阅服务商文档，独立申请凭据或完成 OAuth；未验证跨客户端授权。"
  },
  "availability": "candidate",
  "reason": "来源配置已归一化；须独立验证协议、认证和客户端兼容性。",
  "verification": {
    "structure": "pending",
    "protocol": "not-tested",
    "business": "not-tested"
  }
}
